{
  "$schema": "http://json-schema.org/draft-07/schema#",
  "$id": "https://glosa.example/schema/equation_registry_row.schema.json",
  "title": "glosa equation registry row",
  "description": "tier: Dr (specified; independently unreviewed). Implements FOUNDATION_v0.5.md §8.1: one row per named equation/definition, registered ONCE at first use (Buckingham-trap guard: never re-derive an equation's identity silently). A second project reusing an equation adds itself to `used_in_projects` and creates a kg `derives_from`/`borrows` edge -- it never re-registers under a new id. Namespace https://glosa.example/ is a placeholder.",
  "type": "object",
  "required": ["id", "name", "statement", "owner", "tier", "borrowed_vs_derived_status"],
  "additionalProperties": true,
  "properties": {
    "id": { "type": "string", "pattern": "^eq-[a-z0-9-]+-[0-9]{3}$" },
    "name": { "type": "string", "minLength": 1 },
    "statement": { "type": "string", "minLength": 1 },
    "owner": { "type": "string", "minLength": 1 },
    "first_use_year": { "type": ["integer", "null"] },
    "external_first_publication": { "type": ["string", "null"] },
    "source_citation_card_id": { "type": ["string", "null"] },
    "tier": { "$ref": "common.defs.json#/definitions/tier" },
    "borrowed_vs_derived_status": { "enum": ["BORROWED", "DERIVED", "DERIVED_FROM_BORROWED_ANCHOR"] },
    "superseded_by": { "type": ["string", "null"] },
    "used_in_projects": { "type": "array", "items": { "type": "string" } },
    "notes": { "type": "string" }
  },
  "allOf": [
    {
      "description": "external_first_publication is REQUIRED when borrowed_vs_derived_status is BORROWED or DERIVED_FROM_BORROWED_ANCHOR (template's own rule).",
      "if": { "properties": { "borrowed_vs_derived_status": { "enum": ["BORROWED", "DERIVED_FROM_BORROWED_ANCHOR"] } } },
      "then": { "properties": { "external_first_publication": { "type": "string", "minLength": 1 } }, "required": ["external_first_publication"] }
    }
  ]
}
